<?xml version="1.0"?><!DOCTYPE folders SYSTEM "folders.dtd"><folders>    <folder name="Docs" />    <folder name="Entities" />    <folder name="Models" />    <folder name="resources">   		<folder name="css" />   		<folder name="img" />   		<folder name="js">   			<folder name="controllers" />   			<folder name="entities" />   			<folder name="models" />   			<folder name="utils" />   			<folder name="views" />   		</folder>    </folder>    <folder name="Utils" />    <folder name="Views" /></folders>